[
  {
    "item_id": "code_py_001",
    "version": "1.0.0",
    "domain": "formal_code_reasoning",
    "family": "list_comprehensions",
    "prompt": {
      "question": "What is the stdout output of Python snippet #1?",
      "code_snippet": "x = [i * 2 for i in range(4)]\nprint(x)"
    },
    "options": [
      "[0, 1, 2, 3]",
      "[0, 2, 4, 6]",
      "[2, 4, 6, 8]",
      "[0, 2, 4]"
    ],
    "ground_truth": {
      "canonical": "[0, 2, 4, 6]",
      "option_index": 1
    },
    "partition": "calibration",
    "source": {
      "provenance": "python_3_semantics_benchmark_v1",
      "license": "CC0",
      "url": null
    },
    "difficulty": {
      "language_version": "Python 3.13",
      "tier": "medium"
    },
    "verification": {
      "method": "interpreter_execution_verified",
      "verified": true
    },
    "leakage_checks": [
      "exact_match_clean"
    ]
  },
  {
    "item_id": "code_py_002",
    "version": "1.0.0",
    "domain": "formal_code_reasoning",
    "family": "string_slicing",
    "prompt": {
      "question": "What is the stdout output of Python snippet #2?",
      "code_snippet": "s = 'MAMMAL'\nprint(s[1:4])"
    },
    "options": [
      "MAM",
      "AMM",
      "AMMA",
      "MMA"
    ],
    "ground_truth": {
      "canonical": "AMM",
      "option_index": 1
    },
    "partition": "calibration",
    "source": {
      "provenance": "python_3_semantics_benchmark_v1",
      "license": "CC0",
      "url": null
    },
    "difficulty": {
      "language_version": "Python 3.13",
      "tier": "easy"
    },
    "verification": {
      "method": "interpreter_execution_verified",
      "verified": true
    },
    "leakage_checks": [
      "exact_match_clean"
    ]
  },
  {
    "item_id": "code_py_003",
    "version": "1.0.0",
    "domain": "formal_code_reasoning",
    "family": "dict_lookup",
    "prompt": {
      "question": "What is the stdout output of Python snippet #3?",
      "code_snippet": "d = {'a': 1, 'b': 2}\nprint(d.get('c', 3))"
    },
    "options": [
      "None",
      "KeyError",
      "3",
      "0"
    ],
    "ground_truth": {
      "canonical": "3",
      "option_index": 2
    },
    "partition": "calibration",
    "source": {
      "provenance": "python_3_semantics_benchmark_v1",
      "license": "CC0",
      "url": null
    },
    "difficulty": {
      "language_version": "Python 3.13",
      "tier": "medium"
    },
    "verification": {
      "method": "interpreter_execution_verified",
      "verified": true
    },
    "leakage_checks": [
      "exact_match_clean"
    ]
  },
  {
    "item_id": "code_py_004",
    "version": "1.0.0",
    "domain": "formal_code_reasoning",
    "family": "reference_mutation",
    "prompt": {
      "question": "What is the stdout output of Python snippet #4?",
      "code_snippet": "a = [1, 2, 3]\nb = a\nb.append(4)\nprint(len(a))"
    },
    "options": [
      "3",
      "4",
      "5",
      "Error"
    ],
    "ground_truth": {
      "canonical": "4",
      "option_index": 1
    },
    "partition": "calibration",
    "source": {
      "provenance": "python_3_semantics_benchmark_v1",
      "license": "CC0",
      "url": null
    },
    "difficulty": {
      "language_version": "Python 3.13",
      "tier": "easy"
    },
    "verification": {
      "method": "interpreter_execution_verified",
      "verified": true
    },
    "leakage_checks": [
      "exact_match_clean"
    ]
  },
  {
    "item_id": "code_py_005",
    "version": "1.0.0",
    "domain": "formal_code_reasoning",
    "family": "recursion",
    "prompt": {
      "question": "What is the stdout output of Python snippet #5?",
      "code_snippet": "def f(n):\n    return 1 if n <= 1 else n * f(n - 1)\nprint(f(4))"
    },
    "options": [
      "12",
      "16",
      "24",
      "48"
    ],
    "ground_truth": {
      "canonical": "24",
      "option_index": 2
    },
    "partition": "calibration",
    "source": {
      "provenance": "python_3_semantics_benchmark_v1",
      "license": "CC0",
      "url": null
    },
    "difficulty": {
      "language_version": "Python 3.13",
      "tier": "medium"
    },
    "verification": {
      "method": "interpreter_execution_verified",
      "verified": true
    },
    "leakage_checks": [
      "exact_match_clean"
    ]
  },
  {
    "item_id": "code_py_006",
    "version": "1.0.0",
    "domain": "formal_code_reasoning",
    "family": "generator_expressions",
    "prompt": {
      "question": "What is the stdout output of Python snippet #6?",
      "code_snippet": "res = sum(x for x in [1, 2, 3, 4, 5] if x % 2 == 1)\nprint(res)"
    },
    "options": [
      "6",
      "9",
      "12",
      "15"
    ],
    "ground_truth": {
      "canonical": "9",
      "option_index": 1
    },
    "partition": "calibration",
    "source": {
      "provenance": "python_3_semantics_benchmark_v1",
      "license": "CC0",
      "url": null
    },
    "difficulty": {
      "language_version": "Python 3.13",
      "tier": "easy"
    },
    "verification": {
      "method": "interpreter_execution_verified",
      "verified": true
    },
    "leakage_checks": [
      "exact_match_clean"
    ]
  },
  {
    "item_id": "code_py_007",
    "version": "1.0.0",
    "domain": "formal_code_reasoning",
    "family": "tuple_structure",
    "prompt": {
      "question": "What is the stdout output of Python snippet #7?",
      "code_snippet": "t = (1, 2, [3, 4])\nprint(len(t))"
    },
    "options": [
      "2",
      "3",
      "4",
      "TypeError"
    ],
    "ground_truth": {
      "canonical": "3",
      "option_index": 1
    },
    "partition": "calibration",
    "source": {
      "provenance": "python_3_semantics_benchmark_v1",
      "license": "CC0",
      "url": null
    },
    "difficulty": {
      "language_version": "Python 3.13",
      "tier": "medium"
    },
    "verification": {
      "method": "interpreter_execution_verified",
      "verified": true
    },
    "leakage_checks": [
      "exact_match_clean"
    ]
  },
  {
    "item_id": "code_py_008",
    "version": "1.0.0",
    "domain": "formal_code_reasoning",
    "family": "sorting_indexing",
    "prompt": {
      "question": "What is the stdout output of Python snippet #8?",
      "code_snippet": "nums = [3, 1, 4, 1, 5]\nprint(sorted(nums)[-1])"
    },
    "options": [
      "1",
      "3",
      "4",
      "5"
    ],
    "ground_truth": {
      "canonical": "5",
      "option_index": 3
    },
    "partition": "calibration",
    "source": {
      "provenance": "python_3_semantics_benchmark_v1",
      "license": "CC0",
      "url": null
    },
    "difficulty": {
      "language_version": "Python 3.13",
      "tier": "easy"
    },
    "verification": {
      "method": "interpreter_execution_verified",
      "verified": true
    },
    "leakage_checks": [
      "exact_match_clean"
    ]
  },
  {
    "item_id": "code_py_009",
    "version": "1.0.0",
    "domain": "formal_code_reasoning",
    "family": "ternary_operator",
    "prompt": {
      "question": "What is the stdout output of Python snippet #9?",
      "code_snippet": "x = 5\ny = x if x > 10 else 10\nprint(y)"
    },
    "options": [
      "5",
      "10",
      "15",
      "None"
    ],
    "ground_truth": {
      "canonical": "10",
      "option_index": 1
    },
    "partition": "exploratory",
    "source": {
      "provenance": "python_3_semantics_benchmark_v1",
      "license": "CC0",
      "url": null
    },
    "difficulty": {
      "language_version": "Python 3.13",
      "tier": "medium"
    },
    "verification": {
      "method": "interpreter_execution_verified",
      "verified": true
    },
    "leakage_checks": [
      "exact_match_clean"
    ]
  },
  {
    "item_id": "code_py_010",
    "version": "1.0.0",
    "domain": "formal_code_reasoning",
    "family": "dict_conversion",
    "prompt": {
      "question": "What is the stdout output of Python snippet #10?",
      "code_snippet": "pairs = [(1, 'a'), (2, 'b')]\nprint(dict(pairs)[1])"
    },
    "options": [
      "a",
      "b",
      "1",
      "KeyError"
    ],
    "ground_truth": {
      "canonical": "a",
      "option_index": 0
    },
    "partition": "exploratory",
    "source": {
      "provenance": "python_3_semantics_benchmark_v1",
      "license": "CC0",
      "url": null
    },
    "difficulty": {
      "language_version": "Python 3.13",
      "tier": "easy"
    },
    "verification": {
      "method": "interpreter_execution_verified",
      "verified": true
    },
    "leakage_checks": [
      "exact_match_clean"
    ]
  },
  {
    "item_id": "code_py_011",
    "version": "1.0.0",
    "domain": "formal_code_reasoning",
    "family": "string_methods",
    "prompt": {
      "question": "What is the stdout output of Python snippet #11?",
      "code_snippet": "s = 'hello world'\nprint(s.split()[0])"
    },
    "options": [
      "hello",
      "world",
      "h",
      "hello world"
    ],
    "ground_truth": {
      "canonical": "hello",
      "option_index": 0
    },
    "partition": "exploratory",
    "source": {
      "provenance": "python_3_semantics_benchmark_v1",
      "license": "CC0",
      "url": null
    },
    "difficulty": {
      "language_version": "Python 3.13",
      "tier": "medium"
    },
    "verification": {
      "method": "interpreter_execution_verified",
      "verified": true
    },
    "leakage_checks": [
      "exact_match_clean"
    ]
  },
  {
    "item_id": "code_py_012",
    "version": "1.0.0",
    "domain": "formal_code_reasoning",
    "family": "list_pop",
    "prompt": {
      "question": "What is the stdout output of Python snippet #12?",
      "code_snippet": "nums = [10, 20, 30]\nprint(nums.pop(1))\nprint(len(nums))"
    },
    "options": [
      "10",
      "20",
      "30",
      "IndexError"
    ],
    "ground_truth": {
      "canonical": "20",
      "option_index": 1
    },
    "partition": "exploratory",
    "source": {
      "provenance": "python_3_semantics_benchmark_v1",
      "license": "CC0",
      "url": null
    },